productName,Google descriptions,process
Pyunkang Yul Cleansing Foam," A gentle but mighty cleansing foam made with ledebouriella seseloides extract that delivers highly effective cleansing with lots of delightful bubbles. The stretchy consistency of Pyunkang Cleansing Foam adheres to dirt and oil trapped within pores and removes it, leaving skin feeling clean and fresh without drying. Elastic foam for a dreamy cleansing experience! The formula with a stretchy consistency absorbs skin waste and cleans it thoroughly. Viscous and stretchy cleansing foam that thoroughly absorbs waste and sebum, and cleans them away easily. Root extract helps to cleanse skin well, ... A gentle but mighty cleansing foam made with ledebouriella seseloides extract that deliver highly effective cleansing with lots of delightful bubbles. The ... This cleansers lathers up into a rich foam that effectively rids the skin of dirt and sebum, deeply cleansing the pores while leaving the skin feeling soft, ...",Success
Chacott for Professionals Cleansing Water," It is a non-additive / low stimulant formulated makeup remover that cleanses skin gently, even the area around the eyes. - Suitable for all skin types and ages. - Face wash and cleansing lotion are not necessary. CLEANSING WATER ; Product No. 503602-0007-58 ; Net: 500 ml ; Details: *Hypoallergenic Cleansing. *Oil-free, fragrance-free, Colorant-free, Paraben-free and Alcohol ... Size: 500ml. New packaging, upgraded ingredients. A soap-free cleansing water that effectively removes makeup while cleansing and toning the skin. Chacott Professional Cleansing Water is designed for backstage use with its impressive cleaning power. It is a non-additive / low stimulant formulated ... Chacott Cleansing Water is a multifunctional item that has functions of makeup remover, face wash, and lotion. Its formula is gentle to your skin and eyes.",Success
The Auragins Skin Rescue Brightening Gel Cream ," Hydrate your skin with The Auragins Gel Cream. This lightweight gel-cream is infused with Lime Pearl which helps to brighten and even out skin tone while working to combat the signs of aging. This lightweight gel-cream is infused with Lime Pearl that helps to brighten and even out skin tone while working to combat the signs of aging. Skin Rescue Brightening Gel Cream with an innovative formula nourishes and instantly hydrates the Skin, leaving it hydrated for 24 hours, shiny and radiant. Skin Rescue Brightening Gel Cream with an innovative formula nourishes and instantly hydrates the Skin, leaving it hydrated for 24 hours, shiny and radiant. Gel dưỡng ẩm ngừa mụn, giảm thâm The Auragins Skin Rescue Brightening Gel Cream 100ml | Lixibox. Sự ra đời của thương hiệu the Auragins xuất phát từ niềm mong ...",Success
The Auragins Skin Rescue Brightening Gel Cream ," Hydrate your skin with The Auragins Gel Cream. This lightweight gel-cream is infused with Lime Pearl which helps to brighten and even out skin tone while working to combat the signs of aging. This lightweight gel-cream is infused with Lime Pearl that helps to brighten and even out skin tone while working to combat the signs of aging. Skin Rescue Brightening Gel Cream with an innovative formula nourishes and instantly hydrates the Skin, leaving it hydrated for 24 hours, shiny and radiant. Skin Rescue Brightening Gel Cream with an innovative formula nourishes and instantly hydrates the Skin, leaving it hydrated for 24 hours, shiny and radiant. Gel dưỡng ẩm ngừa mụn, giảm thâm The Auragins Skin Rescue Brightening Gel Cream 100ml | Lixibox. Sự ra đời của thương hiệu the Auragins xuất phát từ niềm mong ...",Success
The Auragins Acne Rescue Patch," The Auragins Acne Rescue Patch has the ability to absorb pus and excess oil from the inflamed area around the acne, aiding in the quick drying of pimple heads. Acne Rescue Patch. Acne Rescue Patch. Shop Now. $10.00. Facial Massaging Roller. Facial Massaging Roller. Shop Now. The Auragins Acne Rescue Patch Miếng Dán Mụn The Auragins Acne Rescue Patch ... Vtari Super Alpha Original Hydrocolloid Intensive Spot Patch | V-Patch | Acne Pimple Healing Patch, Blemish Cover | 24 x 8mm, 30 x 10mm, 24 x 12mm | 1 Box - 78 ... Box 3 Miếng Dán Mụn The Auragins Acne Rescue Patch ... Miếng dán mụn The Auragins Acne Rescue Patch có ... product image slider item. 1 / 1. SALE SHOCK. Box 3 ...",Success
The Auragins Sulcharia Deep Pore Clarifying Clay Mask," The Auragins Sulcharia Deep Pore Clarifying Clay Mask comes to the rescue. This clay mask can effectively clean away excess oil deep within your pores while gently exfoliating dead skin cells, giving you a natural shine. Top K Beauty Sulcharia Deep Pore Clarifying Clay Mask from The Auragins! Check beauty product reviews, ratings, and attributes to address your skin concerns ... Made in Korea Brand: The Auragins Capacity: 9ml Hsd: 3 Years from date of manufacture Oily, dirt deep inside the pores clog, dull skin? Enriched with a powerful blend of Niacinamide and Ceramide to provide instant hydration, and minimize the appearance of pores. When used regularly, your skin is ... The Auragins. Mặt Nạ Đất Sét Loại Bỏ Dầu Nhờn Làm Sạch Sâu Giảm Mụn The Auragins Sulcharia Deep Pore Clarifying Clay Mask 80ml [HSD: 11.2024]. 71 đánh giá. |.",Success
The Auragins Oil Balancing Gel Cleanser," The Auragins Oil Balancing Gel Cleanser is a powerful yet nourishing facial cleanser that takes away impurities and toxins from your skin. The Auragins Oil Balancing Gel Cleanser gentle with suitable pH 6 helps balance moisture in the skin, Tea Tree and Centella Asiatica are perfect for acne-prone ... Gel Rửa Mặt Làm Sạch Sâu Cho Da Dầu Mụn - The Auragins Oil Balancing Gel Cleanser · Menu. product image slider item. 1 / 10. The Auragins. Gel rửa mặt làm sạch sâu cho da dầu mụn The Auragins Oil Balancing Gel Cleanser 150ml. Gel Rửa Mặt Làm Sạch Sâu Cho Da Dầu Mụn The Auragins Oil Balancing Gel Cleanser (150 ml) DEEP34 www.yeuhangduc.vn sẵn sàng cho bạn · Mô tả · More videos on ...",Success
The Auragins Oil Balancing Gel Cleanser," The Auragins Oil Balancing Gel Cleanser is a powerful yet nourishing facial cleanser that takes away impurities and toxins from your skin. The Auragins Oil Balancing Gel Cleanser gentle with suitable pH 6 helps balance moisture in the skin, Tea Tree and Centella Asiatica are perfect for acne-prone ... Gel Rửa Mặt Làm Sạch Sâu Cho Da Dầu Mụn - The Auragins Oil Balancing Gel Cleanser · Menu. product image slider item. 1 / 10. The Auragins. Gel rửa mặt làm sạch sâu cho da dầu mụn The Auragins Oil Balancing Gel Cleanser 150ml. Gel Rửa Mặt Làm Sạch Sâu Cho Da Dầu Mụn The Auragins Oil Balancing Gel Cleanser (150 ml) DEEP34 www.yeuhangduc.vn sẵn sàng cho bạn · Mô tả · More videos on ...",Success
The Auragins Glow Complexion Serum 14% Vitamin C + 6 Berries ExtractsThe Auragins Glow Complexion Serum 14% Vitamin C + 6 Berries Extracts," Try The Auragins 7.5% AHA + 0.5% BHA Gentle Peeling Serum gently exfoliates to remove dead skin cells and unclog pores. After exfoliating, the skin will lose ... Tinh Chất The Auragins Glow Complexion Serum 14% Vitamin C + 6 Berries Extracts Sáng Da Giảm Thâm Nám 15ml | Lixibox. Sự ra đời của thương hiệu the Auragins xu ... Helps to reduce the appearance of pores. Improves uneven skin tone. Helps to reduce the look of spots and balance visible shine. Hyaluronic Acid Hyaluronic Acid ... A gentle radiance-boosting serum that brightens the complexion whilst helping to protect the skin's moisture barrier and prevent free radical damage for ... No photo description available. 󱣽 · 󱙆 · Lixibox. Oct ... Tinh Chất The Auragins Glow Complexion Serum 14% Vitamin C.",Success
The Auragins 10% Niacinamide + 1% Zinc Acne Clear Brightening Serum," A rare Australian native fruit with major sources of vitamin A & C and strong antioxidant properties that helps with uneven skin pigmentation ... This lightweight gel-cream is infused with Lime Pearl that helps to brighten and even out skin tone while working to combat the signs of aging. The Auragins Essence 10% Niacinamide + 1% Zinc Acne Clear ... Product texture: - - Light liquid, quickly ... Stock,Formulation. Description. The Auragins ... Product Description: Grown in Korea for 6 years before harvesting · Dosage Information: Serving Size: 3 tablets per serving · 100% ginseng. · Minimal processing. Skin Rescue Brightening Gel Cream with an innovative formula nourishes and instantly hydrates the Skin, leaving it hydrated for 24 hours, shiny and radiant.",Success
The Auragins 8% Vitamin B5 + Hyaluronic Acid Rehydrating Serum," A rare Australian native fruit with major sources of vitamin A & C and strong antioxidant properties that helps with uneven skin pigmentation ... This lightweight gel-cream is infused with Lime Pearl that helps to brighten and even out skin tone while working to combat the signs of aging. The Auragins Essence 10% Niacinamide + 1% Zinc Acne Clear ... Product texture: - - Light liquid, quickly ... Stock,Formulation. Description. The Auragins ... Product Description: Grown in Korea for 6 years before harvesting · Dosage Information: Serving Size: 3 tablets per serving · 100% ginseng. · Minimal processing. Skin Rescue Brightening Gel Cream with an innovative formula nourishes and instantly hydrates the Skin, leaving it hydrated for 24 hours, shiny and radiant.",Success
The Auragins 7.5% AHA + 0.5% BHA Gentle Peeling Serum," A rare Australian native fruit with major sources of vitamin A & C and strong antioxidant properties that helps with uneven skin pigmentation ... This lightweight gel-cream is infused with Lime Pearl that helps to brighten and even out skin tone while working to combat the signs of aging. The Auragins Essence 10% Niacinamide + 1% Zinc Acne Clear ... Product texture: - - Light liquid, quickly ... Stock,Formulation. Description. The Auragins ... Product Description: Grown in Korea for 6 years before harvesting · Dosage Information: Serving Size: 3 tablets per serving · 100% ginseng. · Minimal processing. Skin Rescue Brightening Gel Cream with an innovative formula nourishes and instantly hydrates the Skin, leaving it hydrated for 24 hours, shiny and radiant.",Success
The Auragins Gentle Brightening Toner," The Auragins toner is uniquely formulated with the power duo AHA and PHA to be an effective yet gentle toner that stimulates skin regeneration. The Auragins Oil Balancing Gel Cleanser gentle with suitable pH 6 helps balance moisture in the skin, Tea Tree and Centella Asiatica are perfect for acne-prone ... product image slider item. 1 / 12. The Auragins. Nước cân bằng sáng da, ngừa mụn AHA PHA The Auragins Gentle Brightening Toner 150ml. 226 ... The Auragins Nước hoa hồng Gentle Brightening Toner 150ml. Tình trạng: Còn hàng | Mã SKU: BL-00021547. Nước Cân Bằng Sáng Da, Ngừa Mụn - The Auragins Gentle Brightening Toner · Menu.",Success
The Auragins Gentle Brightening Toner," The Auragins toner is uniquely formulated with the power duo AHA and PHA to be an effective yet gentle toner that stimulates skin regeneration. The Auragins Oil Balancing Gel Cleanser gentle with suitable pH 6 helps balance moisture in the skin, Tea Tree and Centella Asiatica are perfect for acne-prone ... product image slider item. 1 / 12. The Auragins. Nước cân bằng sáng da, ngừa mụn AHA PHA The Auragins Gentle Brightening Toner 150ml. 226 ... The Auragins Nước hoa hồng Gentle Brightening Toner 150ml. Tình trạng: Còn hàng | Mã SKU: BL-00021547. Nước Cân Bằng Sáng Da, Ngừa Mụn - The Auragins Gentle Brightening Toner · Menu.",Success
Channel SUBLIMAGE L'EXTRAIT DE NUIT," DESCRIPTION. SUBLIMAGE L'Extrait de Nuit is an exceptional serum that concentrates all the active fractions of Vanilla Planifolia, combined with Swertia extract ... DESCRIPTION. CHANEL has created an ultra-limited-edition case for the iconic SUBLIMAGE L'Extrait de Nuit serum. A collector's piece crafted by Lesage, a Maison ... SUBLIMAGE L'Extrait de Nuit is an exceptional serum that concentrates all the active fractions of Vanilla Planifolia, combined with Swertia extract and a ... SUBLIMAGE L'Extrait de Nuit is an exceptional serum that concentrates all the active fractions of Vanilla Planifolia, combined with Swertia extract and a ... DESCRIPTION. CHANEL has created an ultra-limited-edition case for the iconic SUBLIMAGE L'Extrait de Nuit serum. A collector's piece crafted by Lesage, a Maison ...",Success
Channel N°1 DE CHANEL REVITALIZING SERUM," Concentrated with red camellia extract, the N°1 DE CHANEL revitalizing serum has been shown to have long-term effects on skin's vitality and youthful glow. Concentrated with the revitalising properties of red camellia extract, this anti-aging serum prevents and corrects the appearance of the 5 signs of aging. Concentrated with red camellia extract, the N°1 DE CHANEL revitalizing serum has been shown to have long-term effects on skin's vitality and provides a ... This velvety cream visibly smooths wrinkles and leaves the skin soft and radiant. It protects against external aggressors, for skin that radiates a youthful ... It feels more comfortable and glows with vitality. Concentrated with red camellia extract, an active ingredient that boosts cellular vitality, the N°1 DE CHANEL ...",Success
Channel N°1 DE CHANEL REVITALIZING SERUM," Concentrated with red camellia extract, the N°1 DE CHANEL revitalizing serum has been shown to have long-term effects on skin's vitality and youthful glow. Concentrated with the revitalising properties of red camellia extract, this anti-aging serum prevents and corrects the appearance of the 5 signs of aging. Concentrated with red camellia extract, the N°1 DE CHANEL revitalizing serum has been shown to have long-term effects on skin's vitality and provides a ... This velvety cream visibly smooths wrinkles and leaves the skin soft and radiant. It protects against external aggressors, for skin that radiates a youthful ... It feels more comfortable and glows with vitality. Concentrated with red camellia extract, an active ingredient that boosts cellular vitality, the N°1 DE CHANEL ...",Success
Channel N°1 DE CHANEL REVITALIZING SERUM," Concentrated with red camellia extract, the N°1 DE CHANEL revitalizing serum has been shown to have long-term effects on skin's vitality and youthful glow. Concentrated with the revitalising properties of red camellia extract, this anti-aging serum prevents and corrects the appearance of the 5 signs of aging. Concentrated with red camellia extract, the N°1 DE CHANEL revitalizing serum has been shown to have long-term effects on skin's vitality and provides a ... This velvety cream visibly smooths wrinkles and leaves the skin soft and radiant. It protects against external aggressors, for skin that radiates a youthful ... It feels more comfortable and glows with vitality. Concentrated with red camellia extract, an active ingredient that boosts cellular vitality, the N°1 DE CHANEL ...",Success
Channel LE LIFT PRO CRÈME VOLUME," The second step of the skincare protocol, LE LIFT PRO Crème Volume, features a soft, silky texture. It unites melipona enzymatic ingredient and a natural collagen booster in order to plump the skin, smooth deep wrinkles, redefine the appearance facial volume, and rebalance contrast. Products are formulated with potent melipona enzymatic ingredient, which reinforces skin support. The 2nd step of the LE LIFT PRO protocol, Crème Volume, ... Products are formulated with a potent Melipona enzymatic ingredient, which reinforces skin support. The new LE LIFT PRO protocol: a skincare line that addresses the appearance of the youth triangle, the area located between the top of the cheekbones and ... Highly smoothing and firming skincare: LE LIFT Crème illuminates, LE LIFT Sérum fortifies, and LE LIFT Crème Yeux eye cream diminishes the appearance of dark ...",Success
Channel LE LIFT CRÈME," DESCRIPTION. For the first time, CHANEL Research has created a smoothing and firming cream, highly concentrated in naturally occurring ingredients. LE LIFT Crème is formulated with a new star ingredient: botanical alfalfa concentrate, as efficient as retinol* and in a formula that is gentle on the skin. LE LIFT Crème is available in 3 different textures: light, classic, and rich. Each texture adapts perfectly to the skin's needs. The formula combines ultra- ... DESCRIPTION. A night cream with smoothing and firming properties for the face and neck, designed to erase the stress of the day and boost nighttime repairing ... Le Lift Creme Riche 50g/1.7oz. 4.9 out of 5 stars ; Serums & Concentrates by Chanel Le Lift Firming Anti-Wrinkle Serum 30ml ; HYDRA BEAUTY micro sérum 30 ml. Highly smoothing and firming skincare: LE LIFT Crème illuminates, LE LIFT Sérum fortifies, and LE LIFT Crème Yeux eye cream diminishes the appearance of dark ...",Success
Channel N°1 DE CHANEL REVITALIZING CREAM," Concentrated with red camellia extract and red camellia oil, the N°1 DE CHANEL cream contains 95% naturally derived ingredients and 70% camellia-derived ... Benefits. This rich, buttery cream is concentrated with red camellia extract and oil and camellia ceramides. Red camellia extract acts on stage N°1 of skin ... Concentrated with red camellia extract and red camellia oil, the N°1 DE CHANEL cream contains 95% naturally derived ingredients (1) and 70% camellia-derived ... Science backed product review of CHANEL - N°1 DE CHANEL REVITALIZING CREAM. Full ingredients analysis. Effectiveness: 100/100. Irritation potential: medium. Concentrated in red camellia extract and oil and camellia ceramides, the buttery formula of the N°1 DE CHANEL rich cream for face and décolleté visibly smooths ...",Success
Channel HYDRA BEAUTY MICRO SÉRUM," Product Description

 Hydra beauty micro serum has a light texture that feels just like water, allowing you to guarantee continuous skin moisturization over the course of 24 hours. Visibly softer, plumper and more radiant skin! DESCRIPTION. With HYDRA BEAUTY Micro Sérum, CHANEL reinvents hydration. The first serum composed of camellia micro-droplets is based on an exclusive patented ... A water-light serum that delivers a revolutionary infusion of hydration · Provides 24 hours of continuous moisturizing benefits · Leaves skin deeply replenished, ... Description. With HYDRA BEAUTY Micro Sérum, CHANEL reinvents hydration. The first serum composed of camellia micro-droplets is based on an exclusive patented ... Chanel Hydra Beauty Micro Serum Intense Replenishing Hydration 30ml/1oz A groundbreaking highly-hydrating facial serum Features a lightweight watery texture ...",Success
Channel La Mousse Crème Nettoyante Anti-Pollution Cleansing Cream-To-Foam," LA MOUSSE deeply cleanses and purifies the skin. It frees it from impurities, such as pollutants, dust, sweat and excess sebum, while removing traces of makeup. On contact with water, the rich cream texture transforms into a generous, enveloping foam. LA MOUSSE deeply cleanses and purifies the skin. It frees it from impurities, such as pollutants, dust, sweat and excess sebum, while removing traces of makeup ... LA MOUSSE deeply cleanses and purifies the skin. It frees it from impurities, such as pollutants, dust, sweat and excess sebum, while removing traces of ... LA MOUSSE deeply cleanses and purifies the skin. It frees it from impurities, such as pollutants, dust, sweat and excess sebum, while removing traces of makeup. A cleanser with a rich cream texture that transforms into an enveloping foam, refreshing skin and gently removing traces of makeup, sunscreen and pollutants.",Success
Channel SUBLIMAGE LE FLUIDE," DESCRIPTION. SUBLIMAGE Le Fluide is a complete rejuvenating skincare product that hydrates and mattifies the skin. Enriched with polyfractioned Vanilla Planifolia, which provides it with its rejuvenating power, it refines the skin's texture, evens the complexion and offers a soft matte finish. DESCRIPTION. SUBLIMAGE Le Fluide is a complete rejuvenating skincare product that hydrates and mattifies the skin. Enriched with polyfractioned Vanilla ... The action of SUBLIMAGE Le Fluide leaves skin smooth and facial contours firmer. Skin texture is refined and the complexion is even and glowing. Product Description   Sublimage Le Fluide acts on the main factors of a healthy skin: luminosity, firmness and hydration. Skin sublimating fluid! A fluid that ... Crafted by CHANEL, it forms the quintessence of regenerating power. The skin is smoothed and contours feel firmer. The complexion is evened out and glows.To ...",Success
Channel SUBLIMAGE L'EXTRAIT DE NUIT - L'ÉCRIN," DESCRIPTION. CHANEL has created an ultra-limited-edition case for the iconic SUBLIMAGE L'Extrait de Nuit serum. A collector's piece crafted by Lesage, a Maison ... SUBLIMAGE L'EXTRAIT DE NUIT – L'ÉCRIN Ultimate Repair Night Concentrate. More details. Ref. 144878. $1,050. New. Size. 1 FL. OZ. Add to bag. PRODUCT. CHANEL has created an ultra-limited-edition case for the iconic SUBLIMAGE L'Extrait de Nuit serum. A collector's piece crafted by Lesage, a Maison d' ... DESCRIPTION. CHANEL has created an ultra-limited-edition case for the iconic SUBLIMAGE L'Extrait de Nuit serum. A collector's piece crafted by Lesage, a Maison ... PRODUCT DESCRIPTION: CHANEL has created an ultra-limited-edition case for the iconic SUBLIMAGE L'Extrait de Nuit serum. A collector's piece crafted by ...",Success
Channel BOY DE CHANEL FORTIFYING GEL MOISTURIZER," PRODUCT DESCRIPTION   An ultra-fresh moisturising gel with hyaluronic acid and fortifying Costa Rican green coffee extract, specially designed to meet the needs ... PRODUCT. A hydrating, non-greasy gel moisturizer for men that leaves skin feeling fresh post-shave* and perfectly preps the complexion for makeup. Boy De Chanel Fortifying Gel Moisturiser contains a 24-hour hydrating formula. It can also be used as an after-shave or a primer before makeup. A hydrating, non-greasy gel moisturizer for men that leaves skin feeling fresh post-shave* and perfectly preps the complexion for makeup. Upon application, skin ...",Success
Channel SUBLIMAGE LA CRÈME TEXTURE SUPRÊME," SUBLIMAGE La Crème Texture Suprême acts on the look of youth parameters, which have been identified by CHANEL Research. Designed for dry skin, this smooth, rich, and enveloping cream addresses hydration, comfort, wrinkles, structure, uniformity, strength, and radiance. Fresh and milky SUBLIMAGE La Lotion. Lightweight and smooth SUBLIMAGE Le Fluide. Soft and silky SUBLIMAGE La Crème. Ultra-sensorial textures, for the ultimate ... Product Description   Sublimage La Crème Texture Suprême reinforces, revitalizes and perfects the skin, for a truly recovered complexion. A combination of 12 ... SUBLIMAGE La Crème Texture Suprême acts on the look of youth parameters, which have been identified by CHANEL Research. Designed for dry skin, this smooth, rich ... An ultimate regenerating facial cream for dry skin. The rich, enveloping formula addresses the appearance of all youth parameters.",Success
Channel SUBLIMAGE LA CRÈME TEXTURE FINE," DESCRIPTION. SUBLIMAGE La Crème Texture Fine is an exceptional complete skincare product enriched with Vanilla Planifolia. Polyfractioned Vanilla Planifolia is ... Product Information. Description. PRODUCT DESCRIPTION. DESCRIPTION. SUBLIMAGE La Crème Texture Fine is an exceptional complete skincare product enriched with ... The last word in luxury anti-aging treatment: Sublimage La Crème! Exquisitely textured and exceptionally powerful, Chanel Sublimage La Crème intensively ... DESCRIPTION. SUBLIMAGE La Crème Texture Suprême is an exceptional complete skincare product enriched with Vanilla Planifolia. Polyfractioned Vanilla Planifolia ... SUBLIMAGE La Crème Texture Fine acts on the look of youth parameters, which have been identified by CHANEL Research. Ideal for use during the summer or in warm, ...",Success
Channel SUBLIMAGE L'EXTRAIT DE CRÈME, DESCRIPTION. SUBLIMAGE L'Extrait de Crème unites the power of all the active fractions of Vanilla Planifolia with Swertia extract in an exceptional skincare treatment. This one-of-a-kind combination helps rejuvenate skin and accelerate its natural repair mechanisms. DESCRIPTION. SUBLIMAGE L'Extrait de Crème unites the power of all the active fractions of Vanilla Planifolia with Swertia extract in an exceptional skincare ... SUBLIMAGE L'Extrait de Crème unites the power of all the active fractions of Vanilla Planifolia with Swertia extract in an exceptional skincare treatment. SUBLIMAGE L'Extrait de Crème offers the skin all the power of a treatment in an exceptional cream. Revitalised and more resistant to environmental stress each ... DESCRIPTION An exceptional cream that combines every effective element of the Vanilla Planifolia plant with Swertia extract to help rejuvenate the look of ...,Success
